{"schema":1,"kind":"event","agent_id":"agent-alpha","lifecycle_generation":3,"source_epoch":"epoch-7","source_sequence":45,"bridge_observed_ms":1750000000300,"event":{"type":"todos.replaced","revision":9,"items":[{"text":"Design the protocol","completed":true},{"text":"Ship the observer","completed":false}]}}
